title,description,url,published_at,source,categories,sentiment,political_orientation
Zohran Mamdani details how he'd combat Trump — and where they could work together,"On the precipice of winning next week’s New York mayoral contest, Zohran Mamdani cast himself in an interview with NBC News as the city’s bulwark against President Donald Trump, even as the president has threatened his hometown over the prospect of a Mamdani …",https://www.nbcnews.com/politics/elections/zohran-mamdani-details-combat-trump-work-together-rcna240690,2025-10-31,NBC News,Governance,Neutral,left
"Zohran Mamdani wins NYC mayor's race, CBS News projects",The 34-year-old Democratic socialist defeated Republican candidate Curtis Sliwa and former Gov. Andrew Cuomo.,https://www.cbsnews.com/newyork/live-updates/nyc-election-results-2025/,2025-11-04,CBS News,Governance,Positive,left
NYC fire chief announces resignation after Mamdani wins mayoral race,"Fox News Flash top headlines are here. Check out what's clicking on Foxnews.com. Fire Department of the City of New York Commissioner Robert Tucker will be leaving his post next month, announcing his resignation the day after Zohran Mamdani was elected to be the city's next mayor. In a statement, ...",https://www.foxnews.com/politics/nyc-fire-chief-announces-resignation-mamdani-wins-mayoral-race,2025-11-05,Fox News,Governance,Negative,right
"As NYC elects socialist Mamdani, neighboring county doubles down on Trump-style leadership with Blakeman's win","Nassau County Executive Bruce Blakeman thanked President Donald Trump in his victory speech, pledging to continue cooperation with U.S. Immigration and Customs Enforcement (ICE). (Credit: Nassau County Executive's Office) As New York City embraced the left-wing politics of mayor-elect Zohran ...",https://www.foxnews.com/politics/nyc-elects-socialist-mamdani-neighboring-county-doubles-down-trump-style-leadership-blakemans-win,2025-11-05,Fox News,Governance,Negative,right
Lina Khan to co-chair NYC mayor-elect Zohran Mamdani's transition team,"Khan's appointment sends a message to the tech industry, whose most powerful players have already been critical of Mamdani, a Democratic socialist.",https://techcrunch.com/2025/11/05/lina-khan-to-co-chair-nyc-mayor-elect-zohran-mamdanis-transition-team/,2025-11-05,TechCrunch,Governance,Positive,center
Mamdani says he won't be intimidated by any Trump threats about deploying National Guard,New York City mayor-elect Zohran Mamdani details his plans on dealing with President Donald Trump's potential plans to send National Guard troops into the Big Apple. New York City Mayor-elect Zohran Mamdani said Wednesday he wouldn't be intimidated by President Donald Trump's potential threats to ...,https://www.foxnews.com/media/mamdani-says-he-wont-intimidated-any-trump-threats-about-deploying-national-guard,2025-11-05,Fox News,Governance,Positive,right
Jamie Dimon hopes Mamdani calls Detroit mayor for advice,"JPMorgan Chase CEO Jamie Dimon has some advice for New York City Mayor-elect Zohran Mamdani: Talk to the man who helped bring Detroit back from the dead. Dimon, who has been critical of Mamdani, suggested the incoming New York City mayor could learn a lot from outgoing Detroit Mayor Mike ...",https://edition.cnn.com/2025/11/05/business/mamdani-mayor-jamie-dimon-detroit,2025-11-05,CNN,Governance,Neutral,left
Mamdani taps party insiders to steer transition despite vowing to 'turn the page' on old-guard NYC Dems,"New York City mayor-elect Zohran Mamdani details his plans on dealing with President Donald Trump's potential plans to send National Guard troops into the Big Apple. Zohran Mamdani vowed Tuesday night during his victory address to ""turn the page"" on old-guard New York City Democrats, but within ...",https://www.foxnews.com/politics/mamdani-taps-party-insiders-steer-transition-despite-vowing-turn-page-old-guard-nyc-dems,2025-11-05,Fox News,Governance,Neutral,right
"New York will resist Trump 'intimidation,' Mayor-elect Zohran Mamdani says","Mayor-elect Zohran Mamdani appeared Wednesday on ""Good Morning America.""",https://abcnews.go.com/Politics/new-york-resist-trump-intimidation-mayor-elect-zohran/story?id=127210583,2025-11-05,ABC News,Governance,Neutral,left
'Led by an immigrant': NYC Mayor-elect Mamdani calls out Trump in victory speech,The results of the mayoral race that skyrocketed to national attention are in: 34-year-old Zohran Mamdani is projected to be the next mayor of New York City.,https://abcnews.go.com/Politics/mayor-elect-zohran-mamdani-set-address-new-york/story?id=127193119,2025-11-05,ABC News,Governance,Positive,left
"WATCH: Democrat Zohran Mamdani will win the NYC mayoral race, ABC News projects",Mamdani is set to be the city's first Muslim mayor of south Asian descent.,https://abcnews.go.com/Politics/video/democrat-zohran-mamdani-win-nyc-mayoral-race-abc-127200080,2025-11-05,ABC News,Governance,Positive,left
What to know about Zohran Mamdani's wife Rama Duwaji,Duwaji appeared with Mamdani after he secured his election win on Tuesday night.,https://abcnews.go.com/GMA/News/zohran-mamdanis-wife-rama-duwaji-new-york-citys/story?id=127212565,2025-11-05,ABC News,Governance,Neutral,left
Mamdani vows New York will lead opposition to Trump in a fiery speech,"In his first speech as the next mayor of New York, Zohran Mamdani made clear he and his city are coming for President Donald Trump.""If anyone can show a nation betrayed by Donald Trump how to defeat him, it is the city that gave rise to him,"" Mamdani said at …",https://www.nbcnews.com/politics/elections/zohran-mamdani-trump-speech-rcna242039,2025-11-05,NBC News,Governance,Neutral,left
RESULTS,"See live election results for the New York City mayoral race between Democrat Zohran Mamdani, Independent Andrew Cuomo and Republican Curtis Sliwa.",https://www.cnn.com/election/2025/results/new-york-city-mayor,2025-11-05,CNN,Governance,Neutral,left
How each NYC neighborhood voted in the mayoral race,"Zohran Mamdani won every borough except Staten Island, which went for Andrew Cuomo.",https://www.cbsnews.com/newyork/news/nyc-mayoral-race-neighborhood-map/,2025-11-05,CBS News,Governance,Neutral,left
Mamdani wins NYC mayoral election as affordability focus energizes voters,"Zohran Mamdani, a 34-year-old democratic socialist state assemblyman from Queens, will be New York City's 111th mayor.",https://www.cbsnews.com/newyork/news/mamdani-wins-nyc-mayoral-election-2025/,2025-11-05,CBS News,Governance,Positive,left
Breaking down the New York City electorate amid Zohran Mamdani's projected win,CBS News projects that Democrat Zohran Mamdani will win the New York City mayoral race. Caitlin Huey-Burns digs into the exit poll data.,https://www.cbsnews.com/video/breaking-down-new-york-city-electorate-zohran-mamdani-projected-win/,2025-11-05,CBS News,Governance,Neutral,left
Mamdani introduces transition team after NYC mayoral victory,"New York City Mayor-elect Zohran Mamdani introduced his transition team while addressing the media in Queens, New York, on Wednesday after his victory against former New York Gov. Andrew Cuomo and Republican candidate Curtis Sliwa.",https://www.cbsnews.com/video/mamdani-introduces-transition-team-after-nyc-mayoral-victory/,2025-11-05,CBS News,Governance,Neutral,left
"Zohran Mamdani wins New York City mayoral race, CBS News projects","Democratic socialist Zohran Mamdani has won the New York City mayoral race, CBS News projects. CBS News' Anthony Salvanto, Ed O'Keefe reports, Lilia Luciano and Caitlin Huey-Burns have more.",https://www.cbsnews.com/video/zohran-mamdani-wins-new-york-city-mayoral-race-cbs-news-projects/,2025-11-05,CBS News,Governance,Positive,left
Here's what Mamdani's win could mean for Democrats nationwide,"A Democratic Socialists of America leader says New York City Mayor-elect Zohran Mamdani offers a ""powerful way forward"" for Democrats — but some moderates worry he'll hand the GOP ""a pretty potent set of weapons"" in next year's midterms.",https://www.cbsnews.com/news/zohran-mamdani-socialist-2026-midterms-means-for-democrats/,2025-11-05,CBS News,Governance,Neutral,left
"Mamdani tells Trump to ""turn the volume up"" in victory speech as Democrats sweep key races","New York City Mayor-elect Zohran Mamdani adressed President Trump directly during his victory speech on Tuesday night. Meanwhile, Democrats in New Jersey and Virginia swept key races. CBS News' Ed O'Keefe and Nikole Killion have the latest.",https://www.cbsnews.com/video/mamdani-tells-trump-to-turn-the-volume-up-in-victory-speech-as-democrats-sweep-key-races/,2025-11-05,CBS News,Governance,Neutral,left
Democrats sweep major races ahead of 2026 midterms,"Democrats won major contests in Tuesday's elections. In New York City's mayoral race, Zohran Mamdani, a democratic socialist, won over former New York Gov. Andrew Cuomo. Democratic Congresswoman Mikie Sherrill was elected New Jersey governor and Abigail Spanb…",https://www.cbsnews.com/video/democrats-sweep-major-races-ahead-of-2026-midterms/,2025-11-05,CBS News,Governance,Positive,left
Zohran Mamdani wins the New York mayoral race,"Zohran Mamdani has won New York’s mayoral race, NBC News projects, after the 34-year-old democratic socialist energized progressives in the city and across the country while generating intense backlash from President Donald Trump and Republicans, as well as s…",https://www.nbcnews.com/politics/elections/new-york-city-mayor-election-winner-2025-race-rcna238909,2025-11-05,NBC News,Governance,Positive,left
Zohran Mamdani takes on governing as the left and right fight to define him,Zohran Mamdani’s rapid rise from outer-borough state assemblyman to shock Democratic mayoral nominee was already one of the biggest political stories in years in New York City,https://www.nbcnews.com/politics/elections/zohran-mamdani-takes-governing-left-right-fight-define-rcna241705,2025-11-05,NBC News,Governance,Neutral,left
Watch: Zohran Mamdani gives victory speech after projected New York City mayoral win,CBS News projects that Zohran Mamdani will win the New York City mayoral race. See Mamdani's address to supporters on election night.,https://www.cbsnews.com/video/watch-zohran-mamdani-gives-victory-speech-after-projected-win-in-new-york-city-mayoral-race/,2025-11-05,CBS News,Governance,Positive,left
Mamdani’s global city clashes with Trump’s nationalist project,Liberal mayors of major cities around the world have found themselves at odds with ascendant far-right populists. Mamdani will undoubtedly face a similar fight.,https://www.washingtonpost.com/world/2025/11/04/mamdani-trump-democratic-socialism-nationalism/,2025-11-05,The Washington Post,Governance,Neutral,left
Hakeem Jeffries dodges question on whether Mamdani is future of Democratic Party,"Following Zohran Mamdani's decisive mayoral victory in New York City on Tuesday, House Minority Leader Hakeem Jeffries, D-N.Y., dodged a question on whether the self-proclaimed Democratic socialist is the future of the Democratic Party. ""You had record turnout in New York City for this election. ...",https://www.foxnews.com/politics/hakeem-jeffries-dodges-question-whether-mamdani-future-democratic-party,2025-11-06,Fox News,Governance,Neutral,right
GOP warned to take action or 'lose' Gen Z voters after Mamdani wins NYC mayor race,Fox News contributor Brett Cooper reacts to Erika Kirk's interview with Jesse Watters and young voters turning out to the polls in droves for Democratic socialist Zohran Mamdani in New York City. Democratic socialist Zohran Mamdani's victory in New York City's mayoral race jolted conservatives and ...,https://www.foxnews.com/media/gop-warned-take-action-lose-gen-z-voters-after-mamdani-wins-nyc-mayor-race,2025-11-06,Fox News,Governance,Neutral,right
Left-wing podcaster uses Mamdani win to push reeducation of 'crusty White people' to embrace multiculturalism,"Left-wing podcast host Jennifer Welch expressed her joy at the election of New York City's Mayor-elect, Zohran Mamdani, saying it was a sign of the turning political tide against the White conservatives she grew up with. Welch has made headlines for her far-left rhetoric, such as laughing when ...",https://www.foxnews.com/media/left-wing-podcaster-uses-mamdani-win-push-reeducation-crusty-white-people-embrace-multiculturalism,2025-11-06,Fox News,Governance,Negative,right
Houston police union recruits 'disgusted' NYPD officers after New York City elects Mamdani,"New York Post reporter Lydia Moynihan weighs in on the far-left Democrat's New York City mayoral victory and what it could mean for Republicans. After democratic socialist candidate Zohran Mamdani was elected mayor of New York City on Tuesday, the Houston Police Officers' Union seized the ...",https://www.foxnews.com/media/houston-police-union-recruits-disgusted-nypd-officers-after-nyc-elects-mamdani,2025-11-06,Fox News,Governance,Negative,right
White House removes Trump-themed Knicks logo post aimed at Mamdani following team's complaint: report,"President Donald Trump says he wants New York City mayor-elect Zohran Mamdani to succeed, but Communism hasn't worked for thousands of years on 'Special Report.' The White House deleted a post featuring an altered New York Knicks logo following Zohran Mamdani's victory in the city's mayoral ...",https://www.foxnews.com/sports/white-house-removes-trump-themed-knicks-logo-post-aimed-mamdani-following-teams-complaint-report,2025-11-06,Fox News,Governance,Neutral,right
Florida sheriff welcomes New Yorkers after Mamdani win: 'It can be the beginning of a new life',Democratic New York City mayor-elect Zohran Mamdani addresses his supporters after winning a race that saw its highest turnout in decades. A Florida sheriff is urging New York City residents and NYPD officers unhappy with the results of Tuesday's mayoral election to move south to the Sunshine ...,https://www.foxnews.com/us/florida-sheriff-welcomes-new-yorkers-after-mamdani-win-it-can-beginning-new-life,2025-11-06,Fox News,Governance,Negative,right
"Reality check: Democrats celebrate, Trump deflects blame, Mamdani under fire","THE RESULTS ARE IN: 2025'S BIGGEST WINNER AND LOSERS FROM THE OFF-YEAR ELECTIONS Perhaps the most important thing that happened with the Democrats winning big in the off-year elections is the psychological boost. The Democrats haven't had anything to celebrate for a year. Now, they're high-fiving ...",https://www.foxnews.com/media/reality-check-democrats-celebrate-trump-deflects-blame-mamdani-under-fire,2025-11-06,Fox News,Governance,Neutral,right
"From 'mazel tov' to 'conflicted,' Jewish New Yorkers react to Zohran Mamdani's mayoral win","Sen. Chuck Schumer, the New York Democrat and one of the most powerful Jewish politicians in the United States, did not endorse Zohran Mamdani and would not say who he voted for in New York City's mayoral election. But on Wednesday morning, he said he called the mayor-elect to offer his ...",https://edition.cnn.com/2025/11/06/politics/jewish-new-york-mamdani-mayor,2025-11-06,CNN,Governance,Neutral,left
New MAMDANI Act would block federal funds to NYC after socialist's inauguration,"FIRST ON FOX: A House GOP lawmaker is proposing to block federal funds from New York City for as long as Zohran Mamdani is mayor. New legislation led by Rep. Buddy Carter, R-Ga., is called the Moving American Money Distant from Anti-National Interests Act, or the ""MAMDANI Act"" for short. The ...",https://www.foxnews.com/politics/new-mamdani-act-would-block-federal-funds-nyc-after-socialists-inauguration,2025-11-06,Fox News,Governance,Negative,right
Zohran Mamdani refuses to say if Schumer should face election challenge — as he lunches with AOC,One of Zohran Mamdani's staffers cut short an interview with Politico when the mayor-elect was asked if Senate Majority Leader Chuck Schumer should face a primary challenge in 2028.,https://nypost.com/2025/11/06/us-news/zohran-mamdani-refuses-to-say-if-chuck-schumer-should-face-election-challenge-as-he-lunches-with-aoc/,2025-11-06,New York Post,Governance,Neutral,right
Mayor-elect Zohran Mamdani admits he wants to take aggressive action on socialist agenda: 'It is a mandate',"Mayor-elect Zohran Mamdani has admitted he plans to take aggressive action on his potentially budget-busting socialist agenda, defiantly declaring: ""It is a mandate.""",https://nypost.com/2025/11/06/us-news/new-york-city-mayor-elect-zohran-mamdani-admits-he-wants-to-take-aggressive-action-on-socialist-agenda/,2025-11-06,New York Post,Governance,Positive,right
"'Tax the rich' chant breaks out as Gov. Hochul takes the stage at Zohran Mamdani, NY AG Letitia James event","SAN JUAN, Puerto Rico —&nbsp;It&#8217;s the Zoh show. Mayor-elect Zohran Mamdani jetted down to Puerto Rico for the annual SOMOS political retreat, where he basked in his victory by co-hosting a cocktail reception Thursday with embattled ally Attorney General Letitia James. Chants of &#8220;tax the rich&#8221; broke out as Gov. Kathy Hochul took the stage...",https://nypost.com/2025/11/06/us-news/mayor-elect-zohran-mamdani-will-cohost-reception-with-ally-letitia-james-at-influential-somos-retreat-in-puerto-rico-as-gov-kathy-hochul-holds-overlapping-event/,2025-11-06,New York Post,Governance,Positive,right
Did JPMorgan Chase CEO Reach Out To Zohran Mamdani After NYC Mayoral Win?,Did JPMorgan Chase CEO Reach Out To Zohran Mamdani After NYC Mayoral Win?,https://www.ndtvprofit.com/business/did-jpmorgan-chase-ceo-jamie-dimon-reach-out-to-zohran-mamdani-after-nyc-mayoral-win-what-we-know,2025-11-06,Bloomberg,Governance,Neutral,center
Mayor Mamdani: New York businesses share their hopes and worries,"New York's wealthiest had warned of a business exodus if Zohran Mamdani won Tuesday's mayoral race. But for small business owners like Kadjahtou Balde, Mamdani's victory is a reason to stay in one of the country's most expensive cities. ""As somebody who is a young person, who is a mom, who is an ...",https://edition.cnn.com/2025/11/06/business/zohran-mamdani-new-york-small-businesses,2025-11-06,CNN,Governance,Neutral,left
"Analysis: Democratic socialism, according to Zohran Mamdani","A version of this story appeared in CNN's What Matters newsletter. To get it in your inbox, sign up for free here. New York City's Mayor-elect Zohran Mamdani was the Democratic party's candidate in the election, but he proudly describes himself as a democratic socialist alongside left-wing ...",https://edition.cnn.com/2025/11/06/politics/mamdani-democratic-socialism-explained,2025-11-06,CNN,Governance,Neutral,left
"Republicans Retire Pelosi as a Villain, and Turn to Mamdani","Searching for another liberal boogeyman, Republicans have zeroed in on Zohran Mamdani. Whether their strategy will work in the midterms is less clear.",https://www.nytimes.com/2025/11/06/us/politics/nancy-pelosi-zohran-mamdani-republicans.html,2025-11-06,The New York Times,Governance,Neutral,left
Key Trump ally jumps into New York governor's race days after shocking Mamdani mayoral victory,"Rep. Elise Stefanik of New York hints about potentially running for governor on 'The Story.' Rep. Elise Stefanik will officially launch her long-anticipated campaign for New York governor on Friday, entering the 2026 race as a Republican challenger to Democratic Gov. Kathy Hochul, multiple sources ...",https://www.foxnews.com/politics/maga-star-stefanik-jumps-new-york-governor-race-days-after-shocking-mamdani-nyc-mayoral-win,2025-11-07,Fox News,Governance,Negative,right
Trump-pardoned liar George Santos claims he's fleeing NYC over Zohran Mamdani: 'Nice knowing you' - Yahoo News UK,"You never know what is truth versus fiction with George Santos, but the inveterate liar and convicted former GOP congressman is now claiming he'll flee New York City because Zohran Mamdani is going to be the next mayor. Santos, who was recently pardoned and freed from jail by President Donald Trump ...",https://uk.news.yahoo.com/trump-pardoned-liar-george-santos-164819123.html,2025-11-07,Yahoo,Governance,Negative,left
House GOP civil war ignites over 'ludicrous' bill to defund NYC while Mamdani is mayor,"EXCLUSIVE: New York City's lone Republican member of Congress is criticizing an effort within her own party to defund the Big Apple over Zohran Mamdani's victory in the mayoral race on Tuesday. ""These attempts by those within my party to score cheap political points by going after New York City are ...",https://www.foxnews.com/politics/house-gop-civil-war-ignites-over-ludicrous-bill-defund-nyc-while-mamdani-mayor,2025-11-07,Fox News,Governance,Neutral,right
"Fox News Politics Newsletter: Trump, Mamdani front-and-center in Empire State battle","Welcome to the Fox News Politics newsletter, with the latest updates on the Trump administration, Capitol Hill and more Fox News politics content. Here's what's happening... -Justice Barrett urges students to 'take the high road like Erika Kirk' amid campus hostility President Donald Trump and New ...",https://www.foxnews.com/politics/fox-news-politics-newsletter-trump-mamdani-front-and-center-empire-state-battle,2025-11-07,Fox News,Governance,Neutral,right
Mamdani in Puerto Rico for an annual conference of New York political insiders,"New York City Mayor-elect Zohran Mamdani made a triumphant trip to Puerto Rico on Thursday for an annual summit that brings New York politicians and lobbyists to sunny San Juan for strategy meetings, workshops and boozy confabs. Fresh off his election win, Mamdani was greeted by a cheering ...",https://www.yahoo.com/news/articles/mamdani-puerto-rico-annual-conference-181139430.html,2025-11-07,Yahoo,Governance,Neutral,left
"Trump, Mamdani front-and-center in Empire State battle between Hochul, Stefanik","Rep. Elise Stefanik, R-N.Y., joins 'Fox & Friends' to announce her run for New York governor, react to Zohran Mamdani's New York City mayoral victory and share her take on Gov. Kathy Hochul's leadership. President Donald Trump and New York City Mayor-elect Zohran Mamdani are not on the ballot next ...",https://www.foxnews.com/politics/trump-mamdani-front-and-center-empire-state-battle-between-hochul-stefanik,2025-11-07,Fox News,Governance,Neutral,right
Karine Jean-Pierre accuses Democratic leaders of ignoring voters by not endorsing Mamdani,"Former White House press secretary Karine Jean-Pierre and radio host Dean Obeidallah called out Democratic Party leadership for not endorsing Zohran Mamdani. Former White House press secretary Karine Jean-Pierre said that Democratic Party leaders made a ""big mistake"" by not endorsing New York City ...",https://www.foxnews.com/media/karine-jean-pierre-accuses-democratic-leaders-ignoring-voters-not-endorsing-mamdani,2025-11-07,Fox News,Governance,Positive,right
"Zohran Mamdani Just Dropped The Most Savage Advice For Women, And He's So Right","Zohran Mamdani wants to make sure that all of his constituents have affordable housing, universal child care, and boyfriends who don't make them cringe. The mayor-elect of New York City made an appearance on Liz Plank's Boy Problems podcast Tuesday and was asked about a recent Vogue article that ...",https://www.yahoo.com/news/articles/zohran-mamdani-just-dropped-most-144012568.html,2025-11-07,Yahoo,Governance,Positive,left
Eric Adams agreed to 'fully cooperate' with Zohran Mamdani's transition team – as mayor-elect still hasn't booked meeting with NYPD commish,"SAN JUAN, Puerto Rico — They&#8217;re making sure it&#8217;s a smooth transition from A to Z. Zohran Mamdani chatted with his soon-to-be-predecessor Eric Adams about the transition to City Hall, The Post has learned &#8212; as the mayor-elect revealed he still hasn&#8217;t have a meeting booked with NYPD Commissioner Jessica Tisch. Adams promised to &#8220;fully...""",https://nypost.com/2025/11/07/us-news/eric-adams-agreed-to-fully-cooperate-with-zohran-mamdanis-transition-team/,2025-11-07,New York Post,Governance,Neutral,right
Disgraced ex-Rep. George Santos claims he's fleeing NYC to avoid 'evil' of Zohran Mamdani as mayor: 'I'm out',Disgraced former Long Island congressman George Santos dramatically announced he will flee New York City after socialist Zohran Mamdani's victory in the mayoral election.,https://nypost.com/2025/11/07/us-news/george-santos-is-fleeing-new-york-city-after-socialist-zohran-mamdanis-victory-in-the-mayoral-election/,2025-11-07,New York Post,Governance,Negative,right
Stefanik announces New York governor bid in stark counter to NYC mayor-elect Mandani,"New York Rep. Elise Stefanik, a Republican, announced her bid for New York governor days after Zohran Mamdani, a democratic socialist, won the New York City mayoral race. CBS News' Zak Hudak reports.",https://www.cbsnews.com/video/stefanik-announces-new-york-governor-bid-is-stark-counter-to-nyc-mayor-elect-mandani/,2025-11-07,CBS News,Governance,Negative,left
Progressives warn Democrats about alienating the left as they jeer key party leader,Democrats are riding high after Election Day wins and some are capitalizing on the victory of New York City Mayor-Elect Zohran Mamdani,https://abcnews.go.com/US/wireStory/progressives-warn-democrats-alienating-left-jeer-key-party-127317878,2025-11-07,ABC News,Governance,Neutral,left
"Mamdani vs. Lurie: Cheating sports gamblers, place your bets - The Washington Post",Will Mamdani or Lurie lead the way? Or both mayors?,https://www.washingtonpost.com/opinions/2025/11/07/dick-cheney-redistricting-lurie-mamdani/,2025-11-07,The Washington Post,Governance,Neutral,left
How Trump could hamper Zohran Mamdani's New York agenda - Yahoo News Canada,"Just moments after Zohran Mamdani won his battle to become the next mayor of New York City, the rising political star zeroed in on his next fight: taking on the president of the United States. In his victory speech on Tuesday, Mamdani turned to the cameras to directly taunt the president: ""So ...",https://ca.news.yahoo.com/trump-could-hamper-zohran-mamdanis-122749023.html,2025-11-08,Yahoo,Governance,Neutral,left
